{
	"$schema": "http://json-schema.org/draft-07/schema#",
	"$id": "campaign.schema.json",
	"title": "Campaign Definition",
	"description": "Schema for a BAR campaign definition file. Lives at data/singleplayer/campaigns/<campaign>/campaign.json; every subfolder next to it except 'shared' is a mission.",
	"type": "object",
	"required": ["campaignId", "title", "description", "players"],
	"additionalProperties": false,
	"definitions": {
		"identifier": {
			"type": "string",
			"pattern": "^[A-Za-z0-9_-]+$",
			"description": "A non-empty string containing only letters, digits, underscores, and hyphens."
		}
	},
	"properties": {
		"$schema": {
			"type": "string",
			"description": "Path or URL to the JSON Schema for this file."
		},
		"campaignId": {
			"$ref": "#/definitions/identifier"
		},
		"title": {
			"type": "string",
			"description": "Display title of the campaign."
		},
		"description": {
			"type": "string",
			"description": "Short description shown in the campaign selection UI."
		},
		"authors": {
			"type": "array",
			"description": "People credited for this campaign.",
			"minItems": 1,
			"items": {
				"type": "string",
				"minLength": 1
			}
		},
		"backgroundImage": {
			"type": "string",
			"pattern": "^[A-Za-z0-9._-]+$",
			"description": "Filename of the background image used on the campaign screen, relative to this campaign's folder."
		},
		"logo": {
			"type": "string",
			"pattern": "^[A-Za-z0-9._-]+$",
			"description": "Filename of the campaign / faction logo image, relative to this campaign's folder."
		},
		"prerequisites": {
			"type": "array",
			"description": "List of campaign IDs that must be completed before this one is unlocked.",
			"items": {
				"$ref": "#/definitions/identifier"
			}
		},
		"players": {
			"type": "array",
			"description": "Supported player counts.",
			"minItems": 1,
			"items": {
				"type": "integer",
				"minimum": 1
			}
		},
		"missions": {
			"type": "array",
			"description": "Mission IDs in presentation order. Missions found in this campaign's folder but absent here are appended, sorted by ID. IDs must match the 'missionId' of a mission.json in this campaign.",
			"uniqueItems": true,
			"items": {
				"$ref": "#/definitions/identifier"
			}
		},
		"unlocks": {
			"type": "object",
			"description": "Map of mission IDs to their unlock requirements. Missions not listed here have no prerequisites and are unlocked from the start. IDs must match the 'missionId' of a mission.json in this campaign.",
			"propertyNames": {
				"$ref": "#/definitions/identifier"
			},
			"additionalProperties": {
				"type": "array",
				"description": "List of mission IDs that must be completed to unlock this mission.",
				"items": {
					"$ref": "#/definitions/identifier"
				}
			}
		}
	}
}
