{
	"$schema": "../../schemas/campaign.schema.json",
	"campaignId": "armada-main",
	"authors": ["Rasoul"],
	"title": "Test Campaign 1 - Armada",
	"description": "This campaign has Mission API test missions, for now.",
	"backgroundImage": "BAR3-5K_Loadingscreen_1.jpg",
	"logo": "armada_faction.png",

	"players": [1, 2, 4],

	"missions": [
		"start_script_test",
		"markers_test",
		"sound_test",
		"unit_triggers_test",
		"validation_test",
		"test_mission",
		"issue_orders_test",
		"feature_triggers_test",
		"statistics_triggers_test",
		"resource_test",
		"loadout_test",
		"stages_and_objectives_test",
		"unit_mover_test",
		"unit_detection_test",
		"unit_received_order_test"
	],

	"unlocks": {
		"markers_test": ["start_script_test"]
	}
}
