{
	"$schema": "../../schemas/campaign.schema.json",
	"campaignId": "cortex-main",
	"authors": ["Rasoul"],
	"title": "Test Campaign 2 - Cortex",
	"description": "This is a description field meant to hold longer string content.",
	"backgroundImage": "BAR3-5K_Loadingscreen_2.jpg",
	"logo": "cortex_faction.png",

	"prerequisites": ["armada-main"],
	"players": [1, 2, 3, 4]
}
